{
  "$commentaire": "À VALIDER PAR LE PARENT AVANT D'ÊTRE JOUÉ. LOT S3 — `flu.mot.court` PASSE EN PREMIÈRE POSITION, ET CE N'EST PAS UN DÉTAIL DE FORME. `serveur/src/routes/tentatives.ts` ligne 270 lit `competences[0]` et le passe comme compétence par défaut ; `alimenterPedagogie` (serveur/src/depots/tentatives.ts) impute chaque étape à `etape.confusion?.competence ?? competences[0]`. Une réussite n'observe aucune confusion : elle va donc TOUJOURS à la première compétence déclarée, et à elle seule. Mesuré sur les 76 exercices livrés en montant les vrais moteurs : `flu.mot.court` était déclarée par trois exercices et par trois moteurs — R12 la comptait verte — et n'apparaissait en position 0 dans AUCUN. Le journal n'en aurait jamais reçu une seule étape, sa maîtrise serait restée à 0 pour toujours, et `partage/src/pedagogie/selecteur.ts` (`competenceEligible`, seuil 0,60) refuse alors tout nœud portant `comp.litteral` ou `flu.liaison`, qui l'ont en prérequis : dix-sept exercices de la Cité et de la Forêt en dépendent. Le fichier disait déjà ce qui justifie l'échange — « `flu.mot.court` s'ajoute à `lex.couleur` : ces six mots sont d'une ou deux syllabes et l'exposition bornée mesure exactement la fluence ». C'est la fluence que l'exposition à 1800 ms mesure ; `lex.couleur` reste déclarée, garde le canal des confusions (`contenu.competence`) et conserve dix autres exercices qui la portent. Lot M1 — réécriture du contenu bouchon posé à l'intégration v2 ; la marque de bouchon tombe parce que le motif qui la justifiait est levé (le référentiel porte désormais `flu.mot.court`). Deux contraintes MESURÉES dans le moteur, pas supposées. (1) `partage/src/moteurs/eclair/validation.ts` refuse toute option déjà inscrite dans `acquis`, et `acquis` n'est JAMAIS remis à zéro entre deux consignes : les six réponses sont donc six options deux à deux distinctes, et aucune consigne n'offre en leurre une option déjà gagnée — `grise` et `noire` ne sont la réponse de personne, ce sont elles qui complètent les triplets de la fin. Sans cette précaution, `option-deja-choisie` rendrait un leurre inerte : pas une erreur comptée, mais un bouton mort sous le doigt. (2) `modeReponseEclair` dérive p_devinette du nombre d'options RÉELLEMENT offertes (D13) : trois par consigne, donc `qcm-3` de bout en bout, jamais un vrai/faux déguisé qui ferait monter la maîtrise estimée sur du hasard. `expositionMs` reste à 1800 ms — l'enfant déchiffre encore (D14) et le mot éclair n'a d'intérêt que s'il a le temps d'être LU ; c'est un paramètre de données à recalibrer sur l'enfant, jamais une constante de code. `flu.mot.court` s'ajoute à `lex.couleur` : ces six mots sont d'une ou deux syllabes et l'exposition bornée mesure exactement la fluence.",
  "id": "clairiere-luciole-couleurs-01",
  "version": 2,
  "titre": "Les lucioles de couleur",
  "competences": [
    "flu.mot.court",
    "lex.couleur"
  ],
  "difficulte": 1,
  "jeu": {
    "moteur": "eclair",
    "habillage": "clairiere.luciole",
    "noeud": "clairiere-02",
    "etoiles": {
      "sansAide": true,
      "sansErreur": true
    },
    "aideGobi": [
      "relire-consigne",
      "souffle-syllabe",
      "montre-couleur"
    ],
    "contenu": {
      "consignes": [
        {
          "id": "c1",
          "mot": "rouge",
          "texte": "Touche la luciole de la couleur que tu as lue.",
          "forme": "imperative",
          "audio": null,
          "expositionMs": 1800,
          "options": [
            "luciole-rouge",
            "luciole-grise",
            "luciole-bleue"
          ],
          "reponse": "luciole-rouge",
          "motsCles": [
            "touche",
            "luciole",
            "couleur"
          ]
        },
        {
          "id": "c2",
          "mot": "bleu",
          "texte": "Touche la luciole de la couleur que tu as lue.",
          "forme": "imperative",
          "audio": null,
          "expositionMs": 1800,
          "options": [
            "luciole-bleue",
            "luciole-noire",
            "luciole-verte"
          ],
          "reponse": "luciole-bleue",
          "motsCles": [
            "touche",
            "luciole",
            "couleur"
          ]
        },
        {
          "id": "c3",
          "mot": "vert",
          "texte": "Touche la luciole de la couleur que tu as lue.",
          "forme": "imperative",
          "audio": null,
          "expositionMs": 1800,
          "options": [
            "luciole-verte",
            "luciole-grise",
            "luciole-jaune"
          ],
          "reponse": "luciole-verte",
          "motsCles": [
            "touche",
            "luciole",
            "couleur"
          ]
        },
        {
          "id": "c4",
          "mot": "jaune",
          "texte": "Touche la luciole de la couleur que tu as lue.",
          "forme": "imperative",
          "audio": null,
          "expositionMs": 1800,
          "options": [
            "luciole-jaune",
            "luciole-noire",
            "luciole-rose"
          ],
          "reponse": "luciole-jaune",
          "motsCles": [
            "touche",
            "luciole",
            "couleur"
          ]
        },
        {
          "id": "c5",
          "mot": "rose",
          "texte": "Touche la luciole de la couleur que tu as lue.",
          "forme": "imperative",
          "audio": null,
          "expositionMs": 1800,
          "options": [
            "luciole-rose",
            "luciole-grise",
            "luciole-brune"
          ],
          "reponse": "luciole-rose",
          "motsCles": [
            "touche",
            "luciole",
            "couleur"
          ]
        },
        {
          "id": "c6",
          "mot": "brun",
          "texte": "Touche la luciole de la couleur que tu as lue.",
          "forme": "imperative",
          "audio": null,
          "expositionMs": 1800,
          "options": [
            "luciole-brune",
            "luciole-noire",
            "luciole-grise"
          ],
          "reponse": "luciole-brune",
          "motsCles": [
            "touche",
            "luciole",
            "couleur"
          ]
        }
      ],
      "options": [
        {
          "id": "luciole-rouge",
          "libelle": "rouge",
          "bonne": true,
          "confusionAvec": "rose",
          "couleur": "rouge"
        },
        {
          "id": "luciole-bleue",
          "libelle": "bleu",
          "bonne": true,
          "confusionAvec": "blé",
          "couleur": "bleu"
        },
        {
          "id": "luciole-verte",
          "libelle": "vert",
          "bonne": true,
          "confusionAvec": "ver",
          "couleur": "vert"
        },
        {
          "id": "luciole-jaune",
          "libelle": "jaune",
          "bonne": true,
          "confusionAvec": "jeune",
          "couleur": "jaune"
        },
        {
          "id": "luciole-rose",
          "libelle": "rose",
          "bonne": true,
          "confusionAvec": "rouge",
          "couleur": "rose"
        },
        {
          "id": "luciole-brune",
          "libelle": "brun",
          "bonne": true,
          "confusionAvec": "brume",
          "couleur": "brun"
        },
        {
          "id": "luciole-grise",
          "libelle": "gris",
          "bonne": false,
          "confusionAvec": null,
          "couleur": "gris"
        },
        {
          "id": "luciole-noire",
          "libelle": "noir",
          "bonne": false,
          "confusionAvec": null,
          "couleur": "noir"
        }
      ],
      "competence": "lex.couleur"
    }
  }
}
