{
  "$commentaire": "À VALIDER PAR LE PARENT AVANT D'ÊTRE JOUÉ. Lot N8, corrigé par le lot M1 — le contenu gravé n'est pas touché, seule la compétence déclarée change. AXE HAUT-BAS UNIQUEMENT — b ↔ p. C'est l'axe que le père a RAPPORTÉ (D23, fait rapporté : « l'enfant confond b/p »). Le clavier ne porte que deux touches : ajouter d et q y remettrait l'autre axe. L'ARBITRAGE DE N8 EST LEVÉ, ET IL FAUT DIRE POURQUOI PLUTÔT QUE L'EFFACER. N8 écrivait : « R12 exige 3 moteurs par compétence CITÉE ; les Galeries n'ouvrent que 4 nœuds neufs et 3 moteurs hors trace ; on ne peut donc couvrir qu'UN axe à 3 moteurs », et déclarait `comp.consigne.simple` pour ne pas rendre la suite rouge. Le raisonnement était juste sur ses prémisses et le résultat était mauvais : mesuré au gel du contrat du monde v4, `gph.miroir.haut-bas` figurait au référentiel et était porté par ZÉRO exercice, donc le BKT, le Leitner et le Top 10 des confusions ne voyaient jamais l'axe que le père avait signalé. Un compte absent ne valait pas mieux qu'un compte faux : il était pire, parce qu'il était silencieux. Les prémisses ont changé — les Galeries comptent 14 nœuds, et `gph.miroir.haut-bas` est porté par trois moteurs mécaniquement distincts : `trace` (`miroir-bp-01`), `grave` (ce fichier) et `paires` (`echos-paires-01`). R12 est tenue, et la déclaration dit enfin ce que l'exercice fait.",
  "id": "galeries-pierre-bp-01",
  "version": 2,
  "titre": "Graver le b et le p",
  "competences": ["gph.miroir.haut-bas"],
  "difficulte": 4,
  "jeu": {
    "moteur": "grave",
    "habillage": "galeries.veine",
    "noeud": "galeries-06",
    "etoiles": { "sansAide": true, "sansErreur": true },
    "aideGobi": ["relire-consigne", "souffle-syllabe", "surligne-graphene"],
    "contenu": {
      "consignes": [
        {
          "id": "c1",
          "texte": "Trace la lettre pour écrire ce mot.",
          "forme": "imperative",
          "audio": null,
          "mot": "bol",
          "trous": [{ "id": "trou-un", "position": 0, "attendu": "b" }],
          "motsCles": ["grave", "lettre", "mot"]
        },
        {
          "id": "c2",
          "texte": "Trace la lettre pour écrire ce mot.",
          "forme": "imperative",
          "audio": null,
          "mot": "pic",
          "trous": [{ "id": "trou-deux", "position": 0, "attendu": "p" }],
          "motsCles": ["grave", "lettre", "mot"]
        },
        {
          "id": "c3",
          "texte": "Trace la lettre pour écrire ce mot.",
          "forme": "imperative",
          "audio": null,
          "mot": "bus",
          "trous": [{ "id": "trou-trois", "position": 0, "attendu": "b" }],
          "motsCles": ["grave", "lettre", "mot"]
        },
        {
          "id": "c4",
          "texte": "Trace la lettre pour écrire ce mot.",
          "forme": "imperative",
          "audio": null,
          "mot": "poule",
          "trous": [{ "id": "trou-quatre", "position": 0, "attendu": "p" }],
          "motsCles": ["grave", "lettre", "mot"]
        },
        {
          "id": "c5",
          "texte": "Trace la lettre pour écrire ce mot.",
          "forme": "imperative",
          "audio": null,
          "mot": "jupe",
          "trous": [{ "id": "trou-cinq", "position": 2, "attendu": "p" }],
          "motsCles": ["grave", "lettre", "mot"]
        },
        {
          "id": "c6",
          "texte": "Trace la lettre pour écrire ce mot.",
          "forme": "imperative",
          "audio": null,
          "mot": "robe",
          "trous": [{ "id": "trou-six", "position": 2, "attendu": "b" }],
          "motsCles": ["grave", "lettre", "mot"]
        }
      ],
      "clavier": ["b", "p"],
      "competence": "gph.miroir.haut-bas"
    }
  }
}
